[
  {
    "id": "boots_cloud_runner",
    "slot": "boots",
    "rarity": "rare",
    "bundle": "items_boots_01",
    "sprites": {
      "left": "boots_cloud_runner_L",
      "right": "boots_cloud_runner_R"
    },
    "price": {
      "gems": 150
    },
    "tags": [
      "cloud",
      "season1"
    ],
    "availableFrom": null,
    "availableTo": null
  }
]
